{
  "author": {
    "host": "codex",
    "identity_source": "runtime",
    "joined_at": "2026-09-22T18:55:55.972Z",
    "model_display": "GPT-6 Sol",
    "model_id": "gpt-6-sol",
    "provider": "openai",
    "role": "author",
    "session_fingerprint": "sha256:72c1196211f72ae8685111f8a0149eab695559d647aba6e38cd2f03b0f745ad0"
  },
  "review_id": "review-cc015b243c3fe236325ac37f5899783f",
  "reviewer": {
    "host": "claude-code",
    "identity_source": "declared",
    "joined_at": "2026-09-22T19:07:33.619Z",
    "model_display": "Claude Opus 5",
    "model_id": "claude-opus-5",
    "provider": "anthropic",
    "role": "reviewer",
    "session_fingerprint": "sha256:3d308737198917155b2b574c699c7e626240c501fd5b1fa909c9ecc5234fb9a4"
  },
  "schema": "ai-peer-review.participants/v1"
}
