{
  "author": {
    "host": "codex",
    "identity_source": "runtime",
    "joined_at": "2026-09-20T22:18:52.610Z",
    "model_display": "GPT-6 Astra",
    "model_id": "gpt-6-astra",
    "provider": "openai",
    "role": "author",
    "session_fingerprint": "sha256:d9ed2486be1a86d7a3a8e60d0f84b083a8d1e3e2364c316fe5c18126f2576ed7"
  },
  "review_id": "review-d25ab35478c17f6f87b2b8bc4c67190a",
  "reviewer": {
    "host": "codex",
    "identity_source": "runtime",
    "joined_at": "2026-09-20T22:19:59.415Z",
    "model_display": "GPT-5.6 Sol",
    "model_id": "gpt-5.6-sol",
    "provider": "openai",
    "role": "reviewer",
    "session_fingerprint": "sha256:6871f401f6a72a646720760c9a4ccfdcbb3db5fc8e76888427a8d96a3ae73429"
  },
  "schema": "ai-peer-review.participants/v1"
}
