{
  "author": {
    "host": "codex",
    "identity_source": "runtime",
    "joined_at": "2026-09-20T21:48:14.761Z",
    "model_display": "GPT-6 Astra",
    "model_id": "gpt-6-astra",
    "provider": "openai",
    "role": "author",
    "session_fingerprint": "sha256:d9ed2486be1a86d7a3a8e60d0f84b083a8d1e3e2364c316fe5c18126f2576ed7"
  },
  "review_id": "review-bf339e74f46697b4da5d2d19cb3c822e",
  "reviewer": {
    "host": "claude-code",
    "identity_source": "declared",
    "joined_at": "2026-09-20T21:48:53.667Z",
    "model_display": "Claude Opus 5",
    "model_id": "claude-opus-5",
    "provider": "anthropic",
    "role": "reviewer",
    "session_fingerprint": "sha256:7269798814f6e42c7dbd35031039451c136e87664d5bf2159f1e59823321f699"
  },
  "schema": "ai-peer-review.participants/v1"
}
